,output,usable
0,Trump  Putin : Putin      Putin : Trump  Putin : Putin xxbos The Republicans,False
1,Trump is  a Russian asset . xxbos It 's not Trump is  a Russian asset . xxbos The Republicans,False
2,Trump is a  Democrat . He 's a Republican . Trump is a  Putin puppet . xxbos The Mueller report,False
3,Trump should  be impeached . He will be impeached . Trump should  be removed from office . He should be removed,False
4,Trump needs to  Putin . xxbos He 's not a Trump needs to  Putin . xxbos The Mueller report was,False
5,Trump will  be the next President . xxbos It 's Trump will  be the first President to be impeached . xxbos,False
6,Trump has  Putin : Putin xxbos The Republicans Trump has  Putin : Putin xxbos The Republicans,False
7,Trump administration has  NO POLICY TO INDICT TRUMP Trump administration has  ALWAYS been a joke . xxbos The,False
8,Trumpâs  NAFTA    China    China    Trumpâs  NAFTA    China    China,False
9,MAGA  People are saying that Trump is a racist MAGA  People are saying that Trump is a racist,False
10,MAGA rallies are  / s xxbos The Republicans are the ones MAGA rallies are  The White House Cards are the,False
11,Trump rallies are  Fake News ! ! ! The Trump rallies are  The People 's Party : The,False
12,"Trump supporters are  Americans : No , i do n't care Trump supporters are  Americans : No , i do n't care",False
13,Trump is handling  Biden ’s son xxbos The Republicans are Trump is handling  Biden ’s son xxbos The Republicans are,False
14,Biden  Biden is not the best candidate . He Biden  Biden is not the best candidate . He,False
15,Biden is  Biden    Biden is not a good candidate Biden is  Biden    Biden is not a good candidate,False
16,Biden is a  Biden . He is a Biden . Biden is a  Biden . He 's not a Biden,False
17,Biden should  Biden . Biden is not the problem . Biden should  Biden . Biden is not the best candidate,False
18,Biden needs to  be removed from office . He needs to be Biden needs to  be removed from office . He will be removed,False
19,Biden will  Trump . He will be the next Biden will  Trump . He will be the nominee .,False
20,Biden has  Biden . Biden is not the best candidate Biden has  Biden    Biden    Biden,False
21,Bidenâs  The Russians xxbos The Republicans are Bidenâs  The Russians xxbos The Mueller report,False
22,Biden supporters are  Trump supporters . They are the most corrupt Biden supporters are  Trump supporters . They are the most corrupt,False
23,Biden rallies are  the only thing that matters . xxbos The Biden rallies are  Trump supporters : If you want to win,False
24,Sleepy Joe  Joe Biden xxbos The Mueller report Sleepy Joe  Joe Biden xxbos The Republicans are,False
25,Sanders  Sanders    Sanders    Sanders    Sanders  Sanders    Sanders    Sanders,False
26,Sanders is  a Sanders supporter . He 's a Sanders is  a Sanders supporter . He 's a,False
27,"Sanders is a  Sanders supporter , Sanders is a Democrat Sanders is a  Sanders supporter . He 's a Sanders",False
28,Sanders should  Sanders not have any questions or concerns . xxbos Sanders should  Sanders not have a candidate that can be beat,False
29,Sanders needs to  Sanders . He needs to be removed . Sanders needs to  Sanders . xxbos The Republicans are the,False
30,Sanders will  Sanders will not be removed . He will Sanders will  Sanders    Sanders    Sanders,False
31,Sanders has  Sanders    Sanders    Sanders    Sanders has  Sanders    Sanders    Sanders,False
32,Sandersâ  The Russians xxbos The Mueller report Sandersâ  The Russians    https : / / www.npr.org,False
33,"Sanderâs supporters are  Americans : No , i do n't think Sanderâs supporters are  Americans : No , i do n't know",False
34,Bernie  Sanders    Sanders    Sanders    Bernie  Sanders    Sanders    Sanders,False
35,"Bernie is a  Bernie supporter , i 'm a Bernie supporter Bernie is a  Bernie supporter , but i do n't think he",False
36,Bernie should  be the nominee . He 's a centrist . Bernie should  Bernie . He 'll be a better candidate,False
37,Bernie needs to  Trump . He needs to be removed . Bernie needs to  Trump . He needs to be removed .,False
38,Bernie will  Trump xxbos The Mueller report was n't Bernie will  Trump xxbos The Republicans are the ones,False
39,Bernie has  Bernie Sanders    Bernie Sanders    Bernie has  Bernie Sanders    Bernie Sanders,False
40,Bernieâs  The Russians are the enemy . xxbos Bernieâs  The Russians xxbos The Mueller report,False
41,"Bernie supporters  Trump supporters : "" We 're not going Bernie supporters  Trump supporters : "" We 're not going",False
42,Bernie rallies are  Bernie supporters : There are a lot of Bernie rallies are  Bernie supporters : Bernie supporters : Bernie,False
43,Crazy Bernie  Bernie    Bernie    Bernie    Crazy Bernie  Bernie    Bernie    Bernie,False
44,Pelosi  Pelosi    Nancy xxbos The Republicans Pelosi  Nancy Pelosi xxbos It 's not a,False
45,Pelosi is  Nancy Pelosi      Nancy Pelosi      Pelosi is  Nancy Pelosi      Nancy Pelosi,False
46,Pelosi is a   Democrat . She is not a Democrat Pelosi is a   Democrat . She is a Democrat .,False
47,Pelosi should  have a better chance of winning . xxbos It Pelosi should  have a better chance of winning . xxbos The,False
48,Pelosi needs to  Pelosi . She needs to be impeached . Pelosi needs to  Pelosi . She needs to be removed .,False
49,Pelosi will  have a good time . xxbos The Republicans Pelosi will  Impeach Trump . Get the fuck out,False
50,Pelosi has  Nancy . She ’s a good one . Pelosi has  Nancy . She 's not going to do,False
51,Pelosiâs  The Russians xxbos It 's a good Pelosiâs  The Russians xxbos The Mueller report,False
52,Nervous Nancy  Nancy xxbos The Republicans are the ones Nervous Nancy  Nancy xxbos It 's not a transcript .,False
53,McConnell  Mcconnell xxbos The Senate will not convict McConnell  Mcconnell xxbos The Republicans are the ones,False
54,McConnell is  a Christian Antichrist . xxbos The McConnell is  a Democrat .      The Dems are,False
55,"McConnell is a   Democrat , and the Republican party is a McConnell is a   Democrat , and a Democrat .",False
56,McConnell should  be removed from office . xxbos The Republicans McConnell should  be removed from office . xxbos The Republicans,False
57,McConnell needs to  be removed from office . xxbos It 's not McConnell needs to  be removed from office . xxbos The Republicans,False
58,McConnell will  be the new normal xxbos The Republicans are McConnell will  be the new normal xxbos It 's not a,False
59,McConnell has  Mcconnell xxbos It 's not a transcript . McConnell has  Mcconnell xxbos It 's not a transcript .,False
60,McConnellâs  The Russians are the enemy . xxbos McConnellâs  The Russians are the enemy . xxbos,False
61,Moscow Mitch  Putin 's Bitch xxbos The Russians Moscow Mitch  Putin 's Bitch xxbos He 's a,False
62,"Obama  Obama : The US Constitution xxbos Obama  Obama is a terrible president , but he is",False
63,Obama is  a Democrat . He was a Democrat Obama is  a Trump supporter . He 's not a,False
64,Obama was  a Democrat . He was a Republican Obama was  a Democrat . He was a Democrat,False
65,Obama is a  Trump supporter . He 's a Republican Obama is a  Trump supporter . He 's a Republican,False
66,Obama should  have been impeached for lying about the blowjob . xxbos Obama should  have been impeached for lying about the Bidens .,False
67,Obama needs to  Trump . He needs to be removed . Obama needs to  Trump . He needs to be removed .,False
68,Obama will  have a great plan for 2020 . xxbos It Obama will  be the first president to ever be impeached . xxbos,False
69,Obama has  Obama done a great job of making it better Obama has  Obama done this for decades . xxbos The,False
70,Obama administration has  DOJ policy to protect the Constitution . xxbos Obama administration has  US Constitution - United States,False
71,Obamaâs  The Russians xxbos The Mueller report Obamaâs  The Russians xxbos It 's not a,False
72,AOC  Sanders : Do you want to know what AOC  Sanders : Do you want to know what,False
73,AOC is    a Trump supporter . She is a AOC is    a Trump supporter . She is a,False
74,AOC is a  Trump supporter . She 's a Muslim AOC is a  Trump supporter . She is a Democrat,False
75,AOC should  Do n't be a Trump supporter . xxbos AOC should  Do n't be a Trump supporter . xxbos,False
76,AOC needs to  BE HONEST TO THE CONSTITUTION AOC needs to  BE HONEST TO THE CONSTITUTION,False
77,AOC will  Do n't be a Trump supporter . AOC will  Do n't be a Trump supporter . xxbos,False
78,AOC has  It ’s not like she ’s a Muslim AOC has  AOC    Sanders :    Sanders :,False
79,AOCâs  The Russians are the enemy . xxbos AOCâs  The Russians are the enemy . xxbos,False
80,Abortion  Abortion xxbos It 's not a transcript . Abortion  Abortion xxbos The Republicans are the ones,False
81,Abortion should  Have abortion xxbos The Mueller report was Abortion should  Have you considered abortion ? xxbos The,False
82,Pro life  You 're not a Trumper xxbos The Pro life  You 're a fucking moron xxbos The,False
83,Pro choice  Pro Choice : Pro choice . xxbos Pro choice  Pro Choice : Pro choice . xxbos,False
84,"Gun control  Gun control is a crime , and the gun Gun control  Gun control laws are a part of the problem",False
85,Gun control should  be a thing . The NRA is a Gun control should  be a thing . xxbos The Republicans are,False
86,Gun control laws are  a code of all things . The 2A Gun control laws are  a code of hyperbole . xxbos It 's not,False
87,Universal Basic Income  > You can get you to know that you Universal Basic Income  > You can get you to give you a,False
88,"UBI  VETERANS ACT as a veterans force . xxbos UBI  VETERANS , VETERANS , and veterans",False
89,Universal Basic Income is   * * MORE * * *      You Universal Basic Income is   * * MORE * * *      You,False
90,"UBI is  2 : UBI , CARRIES      CARRIES UBI is  2 : UBI , CARRIES      Veterans",False
91,"Affirmative Action  Then again , you 're not going to have Affirmative Action  Then again , you 're not going to have",False
92,Affirmative Action is  Here 's the difference . The President Affirmative Action is  It 's not . It 's not .,False
93,Marijuana  * Marijuana . * * xxbos The Marijuana  * Marijuana . * * xxbos The,False
94,Marijuana should  be a thing . xxbos You 're right . Marijuana should  be a thing . xxbos It 's not a,False
95,Capital punishment  >    > The problem is that the problem Capital punishment  > The problem is that the problem is that,False
96,Capital punishment is  a punishment . The punishment is for a punishment Capital punishment is  a punishment .      The Senate will not,False
97,Military spending  Military spending = a high price xxbos The Military spending  Military spending = a global economy xxbos The,False
98,Military Spending should  be a thing . xxbos You 're right . Military Spending should  be a thing . xxbos You 're right .,False
99,Military  Military Industrial Complex xxbos It 's Military  Military Industrial Complex xxbos The,False
100,Military is  a national security threat . xxbos It 's not Military is  a national security threat . xxbos It 's not,False
101,"Universal healthcare  You 're right , i 'm not a Universal healthcare  You 're right , i 'm not a",False
102,"Universal healthcare is  a system that is not universal healthcare , it 's Universal healthcare is  a basic human right . xxbos It 's not",False
103,"Obamacare  Obamacare was a disaster for the GOP , Obamacare  Obamacare was a disaster for the GOP .",False
104,Obamacare is  Obamacare : Obamacare was a ACA that Obamacare is  Obamacare : Obamacare was a ACA that,False
105,Medicare For All  Medicare for all is not a plan . Medicare For All  Medicare for all is not a plan .,False
106,Medicare For All is  Medicare for all who want it . xxbos Medicare For All is  Medicare for all who want it . xxbos,False
107,The Green New Deal is  Trump Derangement Syndrome . xxbos He The Green New Deal is  Trump Derangement Syndrome xxbos The,False
108,Gay marriage  Gay marriage    Gay marriage    Gay Gay marriage  Gay marriage    Gay marriage    Gay,False
109,Same sex marriage  Trump is a child rapist    Trump is Same sex marriage  Trump is a child rapist    Trump is,False
110,Same sex marriage should  / s xxbos The Republicans are the ones Same sex marriage should  / s xxbos He 's not a Russian,False
111,Transgender athletes  Do n't want to have sex with her    Transgender athletes  Hate Hate Hate Hate Hate,False
112,Trans athletes  https : / / en.wikipedia.org / wiki / Nationalism Trans athletes  https : / / en.wikipedia.org / wiki / Nationalism,False
113,Trans athletes should  be less than 10 % larger than the average person Trans athletes should  be less than 10 % larger than the standard of,False
114,Vaccinations should  Be Best ! xxbos The Republicans Vaccinations should  Be Careful about English . xxbos,False
115,Antivaxers  The Russians xxbos The Mueller report Antivaxers  The Russians xxbos You 're right .,False
116,Antivaxers are  The Squad is a bunch of spineless cowards Antivaxers are  The People are the People . xxbos,False
117,evolution  and never thought it was n't . xxbos The evolution  and never thought of it . xxbos It 's,False
118,impeachment trial  and the impeachment trial will be the first thing that impeachment trial  and the impeachment trial will be the first thing that,False
119,impeachment trial is  a trial . The trial will be a trial impeachment trial is  a trial . xxbos The Republicans are the,False
120,impeachment trial was  underway    But then the Senate voted to impeachment trial was  underway    But then a judge said he could,False
121,police  and i 'm not sure how to respond to that police  >    >    > The United,False
122,cops  do n't get to get a warrant for arrest . cops  do n't get to get a warrant for arrest .,False
123,police are  1 / 3    4 . The police are police are  1 / 3    4 . And i do,False
124,cops are  a problem . xxbos The Republicans are the cops are  a problem . xxbos The Republicans are the,False
125,Police brutality  The Senate is a political party . Police brutality  The Senate is a Republican party .,False
126,Police brutality is  a - * * OK xxbos The Police brutality is  The Army is the police .,False
127,Electoral College  The Electoral College xxbos The Electoral College  The Electoral College xxbos The,False
128,Electoral College is  a national security threat .      The Electoral Electoral College is  a winner . xxbos The Republicans are the,False
129,Student debt  https : / / en.m.wikipedia.org / wiki / Twenty Student debt  https : / / en.wikipedia.org / wiki / Robbery,False
130,Student loans  Big Pharma is $ 1 / trillion a Student loans  Big Tech is $ $ xxbos The,False
131,Student loans should  be a thing xxbos That 's not what i Student loans should  be a thing xxbos The Republicans are the,False
132,border wall  Wall Street street Project    Big border wall  Wall Street street Project    Big,False
133,"border wall is  a wall , wall , and wall ;      border wall is  a wall , wall , and wall ;",False
134,"border wall should  be built in the border wall , and wall of border wall should  be built in the border wall , and wall of",False
135,wall  Mitch mcconnell xxbos The Republicans are the wall  Mitch mcconnell xxbos The Republicans are the,False
136,wall is  1 / 5th of the 5th ; and he 's wall is  1 / 5th of the 5th ; and he 's,False
137,"wall should  be built in the basement of a pizza place , wall should  be built in the basement of a pizza place ,",False
138,Climate change  Climate change xxbos The Republicans are the Climate change  Climate change xxbos This is the best way,False
139,Climate change is  a hoax . The President of the Climate change is  a hoax . The President of the,False
140,Immigration  Immigration    Immigration And Immigration Immigration  Immigration    Immigration And Immigration,False
141,"Immigration laws  Immigration reform will prevent immigration from being passed through Immigration laws  It 's not illegal , but it 's illegal",False
142,Immigration laws should  be enforced .      The immigration laws are a Immigration laws should  be enforced .      The immigration laws are a,False
143,Immigration laws need  Immigration reform to prevent immigration from being passed through Immigration laws need  Immigration reform to prevent immigration from being passed through,False
144,"Immigrants  Edit : Oh , and i do n't Immigrants  Edit : Oh , and the American",False
145,Immigrants are  Immigrants : / / en.wikipedia.org / wiki / Immigrants are  Immigrants are not the problem . They are,False
146,Illegal immigrants  Illegal immigrants are less likely to be illegal than Illegal immigrants  Illegal immigrants are not illegal . Illegal immigrants,False
147,"Illegal immigrants are  - Illegal immigrants .    - Illegal immigrants Illegal immigrants are  - ICE agents , Immigrants are not illegal",False
148,Illegals  Immigrants :      Immigrants :      Immigrants Illegals  Immigrants :      Immigrants :      Immigrants,False
149,Illegals are  Americans . xxbos The Republicans are the Illegals are  Americans . xxbos The Republicans are the,False
150,Illegals should  be deported . They should be deported . Illegals should  be deported . They should be deported .,False
151,DACA  The Border Towers ( NYC ) DACA  The Border Towers ( TOWERS /,False
152,DACA policy  &    Border Patrol ( ICE border DACA policy  &    Border Patrol ( ICE border,False
153,DACA policy is  Border Patrol law - enforcement ( border patrol DACA policy is  Border Patrol law - enforcement ( tax -,False
154,Colleges   r / conservative xxbos The Republicans are the Colleges   r / conservative xxbos The Republicans are the,False
155,Colleges are  https : / / imgur.com / a / Livven Colleges are  https : / / imgur.com / a / Livven,False
156,Big businesses  Big Businesses    Big Businesses    Big businesses  Big Businesses    Big Businesses,False
157,Big businesses are  Big Tech : The Big Big businesses are  Big Tech : The Big,False
158,Corporations  Corporations    Corporations    Corporations    Corporations  Corporations    Corporations    Corporations,False
159,Corporations are  Corporations    Corporations    Corporations ( Corporations are  Corporations    Corporations    Corporations,False
160,Big Pharma is  Big Pharma 's big pharma . They Big Pharma is  Big Pharma 's big pharma . We,False
161,Pharmaceutical industry is  Pharmaceutical industry is a national figure    The Pharmaceutical industry is  Pharmaceutical industry in the 60 's . The,False
162,Big tech  Big Tech    Big Tech    Big tech  Big Tech    Big Tech,False
163,Big tech is  Big Tech : The Big Big tech is  Big Tech : The Big,False
164,Wall street  Trump Tower Moscow : [ https : Wall street  Trump 's Wall Street Journal,False
165,"Wall street is  Big Street Street , Long Wall street is  Big Street Street in Manhattan .",False
166,Billionaires  Billionaires      Billionaires      Billionaires      Billionaires  Billionaires . xxbos The Republicans are the,False
167,Billionaires are  - Billionaires ! xxbos The Mueller report Billionaires are  - Billionaires . xxbos The Republicans are,False
168,The working class  The American people are n't the ones who The working class  The American people are n't really paying attention,False
169,Feminism  Feminism is n't cancer xxbos The Republicans Feminism  Feminism is cancer xxbos It 's not a,False
170,Feminists are  Women of color ? No . They Feminists are  Women of color ? They are not .,False
171,PC culture  PC culture    PC culture    PC PC culture  PC culture    PC culture    PC,False
172,PC culture is  PC culture    - The American PC culture is  - a - way to be a free - market,False
173,Bloomberg  Bloomberg is a New York Times Bloomberg  Bloomberg : The New York,False
174,"Bloomberg is  a New York City Department official Bloomberg is  a New York City Ag ,",False
175,Romney  Romney    Romney    Romney    Romney  Romney    Romney    Romney,False
176,Romney is  a Republican . He is a Republican Romney is  a Republican . He is a Republican,False
177,Kavanaugh  Kavanaugh    Kavanaugh    Kavanaugh    Kavanaugh  Kavanaugh    Kavanaugh    Kavanaugh,False
178,Kavanaugh is  a Republican . They are both above the Kavanaugh is  a Republican . They are both corrupt and,False
179,Kavanaugh should  Kavanaugh and Kavanaugh . xxbos The Kavanaugh should  Kavanaugh and Kavanaugh . xxbos It 's,False
180,Covid19  The Russians xxbos The Republicans are Covid19  The Russians xxbos The Mueller report,False
181,Covid19 is   The Onion xxbos The Senate will Covid19 is   The Onion xxbos The Republicans are,False
182,Coronavirus  The Russians xxbos It 's not a Coronavirus  The Russians are the enemy . xxbos,False
183,Coronavirus is  The Onion xxbos The Republicans are Coronavirus is  a Russian asset . xxbos The Republicans,False
184,Free market is  Free market ! xxbos The Republicans are Free market is  Free market .    Free market .,False
185,Taxes  Tax payer money xxbos The Republicans are Taxes  Tax cuts      Tax cuts      Tax,False
186,Taxes are  Tax cuts for the rich and poor for the Taxes are  a net worth $ 100 m for . You,False
187,Taxes should be  Tax cuts for the rich and poor for the Taxes should be  Tax cuts for the rich and poor for the,False
188,Taxes need to be  secret service to protect the United States Taxes need to be  secret service to protect the United States of,False
189,increase taxes on  taxes for poor people . xxbos You 're right increase taxes on  taxes for poor people . xxbos It 's not,False
190,"lower taxes for  Trump taxes , tax cuts , and tax cuts lower taxes for  the rich and powerful . xxbos The Republicans",False
191,Democrats  Republicans : Do you really think that 's Democrats  Republicans : Do n't want to be president,False
192,Democrats are  Democrats : The Democrats are not the Democrats are  Democrats : Democrats are not allowed to vote,False
193,Republicans  Republicans : Do n't want to be a Republicans  Republicans : Do n't want to be president,False
194,Republicans are  Democrats : Democrats are not good at messaging Republicans are  Democrats : Democrats are not good at messaging,False
195,Dems  The Dems are the ones that are going Dems  The Dems are the ones that are going,False
196,Dems are  The Dems are the ones that are going Dems are  Democrats : The Dems are not the,False
197,GOP  Voters :    Voters : Obama won GOP  Voters :    Voters : Obama won,False
198,GOP is  GOP . xxbos The Republicans are the GOP is  GOP . xxbos It 's not a transcript,False
199,DNC  Hillary    Hillary    Hillary    DNC  Hillary    Hillary    Hillary xxbos,False
200,DNC is  Hillary 's emails    Hillary    DNC DNC is  Hillary 's emails .    Hillary 's emails,False
201,left  Now i 'm just saying that Trump is left  Now i 'm just saying that this is a,False
202,left is  a joke . xxbos The Republicans are the left is  the same as the right . xxbos It 's,False
203,left wing  The right xxbos It 's not a transcript left wing  The right xxbos It 's not a transcript,False
204,left win is  the right way to win the election is to win left win is  another win for the Dems . xxbos This,False
205,right  And the Democrats are the ones that are right  And the Republicans are just as guilty .,False
206,"right is  ... but it 's not a "" transcript "" . right is  the same way the Russians used the Russian",False
207,right wing  Putin 's bitch xxbos The Republicans are right wing  Putin 's bitch xxbos The Republicans are,False
208,"right wing is  the right wing , and the left is the right right wing is  r / politicalhumor xxbos The Republicans are the",False
209,Liberals  https : / / i.imgur.com / Please - make Liberals  https : / / en.wikipedia.org / wiki / Whataboutism,False
210,Liberals are  Liberals : Liberals are the liberals ! Liberals are  Liberals : LOL xxbos The Republicans,False
211,Conservative  Republicans are the ones who are not the party Conservative  Republicans are the ones who are not the party,False
212,Conservatives are  Democrats : The Democrats are not the Conservatives are  Conservatives : Conservatives are the enemy .,False
213,Progressives  Bernie Sanders / Warren / Bernie Progressives  Bernie Sanders / Warren / Bernie,False
214,Progressives are  Bernie Sanders supporters . They are the Progressives are  Bernie Sanders supporters . They are the,False
215,Socialism  Socialism      Socialism      Socialism      Socialism  Socialism      Socialism      Socialism,False
216,"Socialism is  Socialism      Socialism is , Socialism      Socialism is  Socialism      Socialism is , Socialism",False
217,Socialists  Socialists xxbos The Republicans are the party Socialists  Socialists xxbos The Mueller report was n't,False
218,Socialists are  Socialists : Socialists .      Socialists : Socialists are  Socialists : Socialists .      Socialists :,False
219,"Centrists  Centrists like Warren and Sanders . Centrists  Republicans : "" We 're all Democrats",False
220,"Centrists are  Centrists . Centrists . Centrists . Centrists are  Liberals : "" Liberals are liberals ! """,False
221,"Centrist Democrats  Do n't get me wrong , i 'm just Centrist Democrats  Do n't get me wrong , i 'm a",False
222,Centrist Democrats are  Centrist Dems . They are the same Centrist Democrats are  Centrist Dems . They are the ones,False
223,"Centrist Republicans  Do n't get me wrong , i 'm a Centrist Republicans  Do n't get me wrong , i 'm just",False
224,"Centrist Republicans are  Democrats : We are not Republicans . Centrist Republicans are  Democrats : No , i do n't want",False
225,Democratic socialism  Socialism is not socialism . xxbos The Democratic socialism  Socialism is not socialism . xxbos The,False
226,Democratic socialism is  Socialism . Socialism is the Socialism . Democratic socialism is  Socialism . Socialism is the socialism .,False
